ID	Label	Definition	Definition Source	Editor Note	Editor	Type	Parent Class	Is About	Data Subset	Data Subset	Data Subset	Data Subset	Data Subset	Data Subset	Sort Index	Disjoint Class	Data Item	Data Item	Data Item	Data Item	Data Item	Data Item	Data Item	Data Item	Data Item	Data Item	Data Item	Data Item	Data Item	Data Item	Data Item	Data Item	Data Item	Data Item	Data Item	Data Item	Data Item	Data Item	Data Item	Data Item	Data Item	Data Item	Data Item	Data Item	Data Item	Data Item	Data Item	Data Item	Data Item	Data Item	Data Item	Data Item	Data Item	Data Item	Data Item	Data Item	Data Item	Data Item	Data Item	Data Item	Data Item	Data Item	Data Item	Data Item	Data Item	Data Item	Data Item	Data Item	Data Item	Data Item	Data Item	Data Item	Data Item	Data Item	Data Item	Data Item	Data Item	Data Item	Data Item	Data Item	Data Item	Data Item	Data Item	Data Item	Data Item	Data Item	Data Item	Data Item	Data Item	Data Item	Data Item	Data Item	Data Item	Data Item	Data Item	Data Item	Data Item	Data Item	Data Item	Data Item	Data Item	Data Item	Data Item	Data Item	Data Item	Data Item	Data Item	Data Item	Data Item	Data Item	Data Item	Data Item
ID	AL rdfs:label@en	AL IAO:0000115@en	AL IAO:0000119@en	AL IAO:0000116@en	A IAO:0000117	TYPE	SC %	I 'is about'	SC %	SC %	SC %	SC %	SC %	SC %	I 'sort as'	DC %	SC %	SC %	SC %	SC %	SC %	SC %	SC %	SC %	SC %	SC %	SC %	SC %	SC %	SC %	SC %	SC %	SC %	SC %	SC %	SC %	SC %	SC %	SC %	SC %	SC %	SC %	SC %	SC %	SC %	SC %	SC %	SC %	SC %	SC %	SC %	SC %	SC %	SC %	SC %	SC %	SC %	SC %	SC %	SC %	SC %	SC %	SC %	SC %	SC %	SC %	SC %	SC %	SC %	SC %	SC %	SC %	SC %	SC %	SC %	SC %	SC %	SC %	SC %	SC %	SC %	SC %	SC %	SC %	SC %	SC %	SC %	SC %	SC %	SC %	SC %	SC %	SC %	SC %	SC %	SC %	SC %	SC %	SC %	SC %	SC %	SC %	SC %	SC %	SC %	SC %	SC %	SC %	SC %	SC %	SC %	SC %
phaleron-dpatho:PhaleronDentalPaleopathologyDataset	Phaleron dental paleopathology dataset	Dataset resulting from an investigation of dental pathology.	Felix Engel		Felix Engel	class	obo:IAO_0000100		('has part' some phaleron-dpatho:DentalPaleopathologyPermanentMaxillaryArcade )	('has part' some phaleron-dpatho:DentalPaleopathologyPermanentMandibularArcade )	('has part' some phaleron-dpatho:DentalPaleopathologyDeciduousMaxillaryArcade )	('has part' some phaleron-dpatho:DentalPaleopathologyDeciduousMandibularArcade )																																																																																																				
phaleron-dpatho:PhaleronDentalPaleopathologyDatasetSection	Phaleron dental paleopathology dataset section	Section of a dental pathology dataset.	Felix Engel		Felix Engel	class	obo:IAO_0000100																																																																																																									
phaleron-dpatho:DentalPaleopathologyPermanentMaxillaryArcade	Dental pathology of permanent maxillary arcade	Section of a dental pathology dataset containing information about the permanent maxillary dentition.	Felix Engel		Felix Engel	class	phaleron-dpatho:PhaleronDentalPaleopathologyDatasetSection										('has part' some (phaleron-dpatho:Caries and ('is about' exactly 1 rdfbones:EntireTooth_fma55696)))	('has part' some (phaleron-dpatho:Caries and ('is about' exactly 1 rdfbones:EntireTooth_fma55697)))	('has part' some (phaleron-dpatho:Caries and ('is about' exactly 1 rdfbones:EntireTooth_fma55698)))	('has part' some (phaleron-dpatho:Caries and ('is about' exactly 1 rdfbones:EntireTooth_fma55688)))	('has part' some (phaleron-dpatho:Caries and ('is about' exactly 1 rdfbones:EntireTooth_fma55689)))	('has part' some (phaleron-dpatho:Caries and ('is about' exactly 1 rdfbones:EntireTooth_fma55798)))	('has part' some (phaleron-dpatho:Caries and ('is about' exactly 1 rdfbones:EntireTooth_fma55680)))	('has part' some (phaleron-dpatho:Caries and ('is about' exactly 1 rdfbones:EntireTooth_fma55681)))	('has part' some (phaleron-dpatho:Caries and ('is about' exactly 1 rdfbones:EntireTooth_fma55682)))	('has part' some (phaleron-dpatho:Caries and ('is about' exactly 1 rdfbones:EntireTooth_fma55683)))	('has part' some (phaleron-dpatho:Caries and ('is about' exactly 1 rdfbones:EntireTooth_fma55799)))	('has part' some (phaleron-dpatho:Caries and ('is about' exactly 1 rdfbones:EntireTooth_fma55690)))	('has part' some (phaleron-dpatho:Caries and ('is about' exactly 1 rdfbones:EntireTooth_fma55691)))	('has part' some (phaleron-dpatho:Caries and ('is about' exactly 1 rdfbones:EntireTooth_fma55699)))	('has part' some (phaleron-dpatho:Caries and ('is about' exactly 1 rdfbones:EntireTooth_fma55700)))	('has part' some (phaleron-dpatho:Caries and ('is about' exactly 1 rdfbones:EntireTooth_fma55701)))	('has part' some (phaleron-dpatho:PresenceOfCalculus and ('is about' exactly 1 rdfbones:EntireTooth_fma55696)))	('has part' some (phaleron-dpatho:PresenceOfCalculus and ('is about' exactly 1 rdfbones:EntireTooth_fma55697)))	('has part' some (phaleron-dpatho:PresenceOfCalculus and ('is about' exactly 1 rdfbones:EntireTooth_fma55698)))	('has part' some (phaleron-dpatho:PresenceOfCalculus and ('is about' exactly 1 rdfbones:EntireTooth_fma55688)))	('has part' some (phaleron-dpatho:PresenceOfCalculus and ('is about' exactly 1 rdfbones:EntireTooth_fma55689)))	('has part' some (phaleron-dpatho:PresenceOfCalculus and ('is about' exactly 1 rdfbones:EntireTooth_fma55798)))	('has part' some (phaleron-dpatho:PresenceOfCalculus and ('is about' exactly 1 rdfbones:EntireTooth_fma55680)))	('has part' some (phaleron-dpatho:PresenceOfCalculus and ('is about' exactly 1 rdfbones:EntireTooth_fma55681)))	('has part' some (phaleron-dpatho:PresenceOfCalculus and ('is about' exactly 1 rdfbones:EntireTooth_fma55682)))	('has part' some (phaleron-dpatho:PresenceOfCalculus and ('is about' exactly 1 rdfbones:EntireTooth_fma55683)))	('has part' some (phaleron-dpatho:PresenceOfCalculus and ('is about' exactly 1 rdfbones:EntireTooth_fma55799)))	('has part' some (phaleron-dpatho:PresenceOfCalculus and ('is about' exactly 1 rdfbones:EntireTooth_fma55690)))	('has part' some (phaleron-dpatho:PresenceOfCalculus and ('is about' exactly 1 rdfbones:EntireTooth_fma55691)))	('has part' some (phaleron-dpatho:PresenceOfCalculus and ('is about' exactly 1 rdfbones:EntireTooth_fma55699)))	('has part' some (phaleron-dpatho:PresenceOfCalculus and ('is about' exactly 1 rdfbones:EntireTooth_fma55700)))	('has part' some (phaleron-dpatho:PresenceOfCalculus and ('is about' exactly 1 rdfbones:EntireTooth_fma55701)))	('has part' some (phaleron-dpatho:LocationOfCalculus and ('is about' exactly 1 rdfbones:EntireTooth_fma55696)))	('has part' some (phaleron-dpatho:LocationOfCalculus and ('is about' exactly 1 rdfbones:EntireTooth_fma55697)))	('has part' some (phaleron-dpatho:LocationOfCalculus and ('is about' exactly 1 rdfbones:EntireTooth_fma55698)))	('has part' some (phaleron-dpatho:LocationOfCalculus and ('is about' exactly 1 rdfbones:EntireTooth_fma55688)))	('has part' some (phaleron-dpatho:LocationOfCalculus and ('is about' exactly 1 rdfbones:EntireTooth_fma55689)))	('has part' some (phaleron-dpatho:LocationOfCalculus and ('is about' exactly 1 rdfbones:EntireTooth_fma55798)))	('has part' some (phaleron-dpatho:LocationOfCalculus and ('is about' exactly 1 rdfbones:EntireTooth_fma55680)))	('has part' some (phaleron-dpatho:LocationOfCalculus and ('is about' exactly 1 rdfbones:EntireTooth_fma55681)))	('has part' some (phaleron-dpatho:LocationOfCalculus and ('is about' exactly 1 rdfbones:EntireTooth_fma55682)))	('has part' some (phaleron-dpatho:LocationOfCalculus and ('is about' exactly 1 rdfbones:EntireTooth_fma55683)))	('has part' some (phaleron-dpatho:LocationOfCalculus and ('is about' exactly 1 rdfbones:EntireTooth_fma55799)))	('has part' some (phaleron-dpatho:LocationOfCalculus and ('is about' exactly 1 rdfbones:EntireTooth_fma55690)))	('has part' some (phaleron-dpatho:LocationOfCalculus and ('is about' exactly 1 rdfbones:EntireTooth_fma55691)))	('has part' some (phaleron-dpatho:LocationOfCalculus and ('is about' exactly 1 rdfbones:EntireTooth_fma55699)))	('has part' some (phaleron-dpatho:LocationOfCalculus and ('is about' exactly 1 rdfbones:EntireTooth_fma55700)))	('has part' some (phaleron-dpatho:LocationOfCalculus and ('is about' exactly 1 rdfbones:EntireTooth_fma55701)))	('has part' some (phaleron-dpatho:Hypoplasia and ('is about' exactly 1 rdfbones:EntireTooth_fma55696)))	('has part' some (phaleron-dpatho:Hypoplasia and ('is about' exactly 1 rdfbones:EntireTooth_fma55697)))	('has part' some (phaleron-dpatho:Hypoplasia and ('is about' exactly 1 rdfbones:EntireTooth_fma55698)))	('has part' some (phaleron-dpatho:Hypoplasia and ('is about' exactly 1 rdfbones:EntireTooth_fma55688)))	('has part' some (phaleron-dpatho:Hypoplasia and ('is about' exactly 1 rdfbones:EntireTooth_fma55689)))	('has part' some (phaleron-dpatho:Hypoplasia and ('is about' exactly 1 rdfbones:EntireTooth_fma55798)))	('has part' some (phaleron-dpatho:Hypoplasia and ('is about' exactly 1 rdfbones:EntireTooth_fma55680)))	('has part' some (phaleron-dpatho:Hypoplasia and ('is about' exactly 1 rdfbones:EntireTooth_fma55681)))	('has part' some (phaleron-dpatho:Hypoplasia and ('is about' exactly 1 rdfbones:EntireTooth_fma55682)))	('has part' some (phaleron-dpatho:Hypoplasia and ('is about' exactly 1 rdfbones:EntireTooth_fma55683)))	('has part' some (phaleron-dpatho:Hypoplasia and ('is about' exactly 1 rdfbones:EntireTooth_fma55799)))	('has part' some (phaleron-dpatho:Hypoplasia and ('is about' exactly 1 rdfbones:EntireTooth_fma55690)))	('has part' some (phaleron-dpatho:Hypoplasia and ('is about' exactly 1 rdfbones:EntireTooth_fma55691)))	('has part' some (phaleron-dpatho:Hypoplasia and ('is about' exactly 1 rdfbones:EntireTooth_fma55699)))	('has part' some (phaleron-dpatho:Hypoplasia and ('is about' exactly 1 rdfbones:EntireTooth_fma55700)))	('has part' some (phaleron-dpatho:Hypoplasia and ('is about' exactly 1 rdfbones:EntireTooth_fma55701)))	('has part' some (phaleron-dpatho:Abscess and ('is about' exactly 1 rdfbones:EntireToothSocket_fma317364)))	('has part' some (phaleron-dpatho:Abscess and ('is about' exactly 1 rdfbones:EntireToothSocket_fma317362)))	('has part' some (phaleron-dpatho:Abscess and ('is about' exactly 1 rdfbones:EntireToothSocket_fma317360)))	('has part' some (phaleron-dpatho:Abscess and ('is about' exactly 1 rdfbones:EntireToothSocket_fma317358)))	('has part' some (phaleron-dpatho:Abscess and ('is about' exactly 1 rdfbones:EntireToothSocket_fma317356)))	('has part' some (phaleron-dpatho:Abscess and ('is about' exactly 1 rdfbones:EntireToothSocket_fma317354)))	('has part' some (phaleron-dpatho:Abscess and ('is about' exactly 1 rdfbones:EntireToothSocket_fma317352)))	('has part' some (phaleron-dpatho:Abscess and ('is about' exactly 1 rdfbones:EntireToothSocket_fma317350)))	('has part' some (phaleron-dpatho:Abscess and ('is about' exactly 1 rdfbones:EntireToothSocket_fma317366)))	('has part' some (phaleron-dpatho:Abscess and ('is about' exactly 1 rdfbones:EntireToothSocket_fma317368)))	('has part' some (phaleron-dpatho:Abscess and ('is about' exactly 1 rdfbones:EntireToothSocket_fma317370)))	('has part' some (phaleron-dpatho:Abscess and ('is about' exactly 1 rdfbones:EntireToothSocket_fma317372)))	('has part' some (phaleron-dpatho:Abscess and ('is about' exactly 1 rdfbones:EntireToothSocket_fma317374)))	('has part' some (phaleron-dpatho:Abscess and ('is about' exactly 1 rdfbones:EntireToothSocket_fma317376)))	('has part' some (phaleron-dpatho:Abscess and ('is about' exactly 1 rdfbones:EntireToothSocket_fma317378)))	('has part' some (phaleron-dpatho:Abscess and ('is about' exactly 1 rdfbones:EntireToothSocket_fma317380)))	('has part' some (phaleron-dpatho:AlveolarResorption and ('is about' exactly 1 rdfbones:EntireToothSocket_fma317364)))	('has part' some (phaleron-dpatho:AlveolarResorption and ('is about' exactly 1 rdfbones:EntireToothSocket_fma317362)))	('has part' some (phaleron-dpatho:AlveolarResorption and ('is about' exactly 1 rdfbones:EntireToothSocket_fma317360)))	('has part' some (phaleron-dpatho:AlveolarResorption and ('is about' exactly 1 rdfbones:EntireToothSocket_fma317358)))	('has part' some (phaleron-dpatho:AlveolarResorption and ('is about' exactly 1 rdfbones:EntireToothSocket_fma317356)))	('has part' some (phaleron-dpatho:AlveolarResorption and ('is about' exactly 1 rdfbones:EntireToothSocket_fma317354)))	('has part' some (phaleron-dpatho:AlveolarResorption and ('is about' exactly 1 rdfbones:EntireToothSocket_fma317352)))	('has part' some (phaleron-dpatho:AlveolarResorption and ('is about' exactly 1 rdfbones:EntireToothSocket_fma317350)))	('has part' some (phaleron-dpatho:AlveolarResorption and ('is about' exactly 1 rdfbones:EntireToothSocket_fma317366)))	('has part' some (phaleron-dpatho:AlveolarResorption and ('is about' exactly 1 rdfbones:EntireToothSocket_fma317368)))	('has part' some (phaleron-dpatho:AlveolarResorption and ('is about' exactly 1 rdfbones:EntireToothSocket_fma317370)))	('has part' some (phaleron-dpatho:AlveolarResorption and ('is about' exactly 1 rdfbones:EntireToothSocket_fma317372)))	('has part' some (phaleron-dpatho:AlveolarResorption and ('is about' exactly 1 rdfbones:EntireToothSocket_fma317374)))	('has part' some (phaleron-dpatho:AlveolarResorption and ('is about' exactly 1 rdfbones:EntireToothSocket_fma317376)))	('has part' some (phaleron-dpatho:AlveolarResorption and ('is about' exactly 1 rdfbones:EntireToothSocket_fma317378)))	('has part' some (phaleron-dpatho:AlveolarResorption and ('is about' exactly 1 rdfbones:EntireToothSocket_fma317380)))
phaleron-dpatho:DentalPaleopathologyPermanentMandibularArcade	Dental pathology of permanent mandibular arcade	Section of a dental pathology dataset containing information about the permanent mandibular dentition.	Felix Engel		Felix Engel	class	phaleron-dpatho:PhaleronDentalPaleopathologyDatasetSection										('has part' some (phaleron-dpatho:Caries and ('is about' exactly 1 rdfbones:EntireTooth_fma55702)))	('has part' some (phaleron-dpatho:Caries and ('is about' exactly 1 rdfbones:EntireTooth_fma55703)))	('has part' some (phaleron-dpatho:Caries and ('is about' exactly 1 rdfbones:EntireTooth_fma55704)))	('has part' some (phaleron-dpatho:Caries and ('is about' exactly 1 rdfbones:EntireTooth_fma55692)))	('has part' some (phaleron-dpatho:Caries and ('is about' exactly 1 rdfbones:EntireTooth_fma55693)))	('has part' some (phaleron-dpatho:Caries and ('is about' exactly 1 rdfbones:EntireTooth_fma55687)))	('has part' some (phaleron-dpatho:Caries and ('is about' exactly 1 rdfbones:EntireTooth_fma57141)))	('has part' some (phaleron-dpatho:Caries and ('is about' exactly 1 rdfbones:EntireTooth_fma57143)))	('has part' some (phaleron-dpatho:Caries and ('is about' exactly 1 rdfbones:EntireTooth_fma57142)))	('has part' some (phaleron-dpatho:Caries and ('is about' exactly 1 rdfbones:EntireTooth_fma57140)))	('has part' some (phaleron-dpatho:Caries and ('is about' exactly 1 rdfbones:EntireTooth_fma55686)))	('has part' some (phaleron-dpatho:Caries and ('is about' exactly 1 rdfbones:EntireTooth_fma55694)))	('has part' some (phaleron-dpatho:Caries and ('is about' exactly 1 rdfbones:EntireTooth_fma55695)))	('has part' some (phaleron-dpatho:Caries and ('is about' exactly 1 rdfbones:EntireTooth_fma55705)))	('has part' some (phaleron-dpatho:Caries and ('is about' exactly 1 rdfbones:EntireTooth_fma55706)))	('has part' some (phaleron-dpatho:Caries and ('is about' exactly 1 rdfbones:EntireTooth_fma55707)))	('has part' some (phaleron-dpatho:PresenceOfCalculus and ('is about' exactly 1 rdfbones:EntireTooth_fma55702)))	('has part' some (phaleron-dpatho:PresenceOfCalculus and ('is about' exactly 1 rdfbones:EntireTooth_fma55703)))	('has part' some (phaleron-dpatho:PresenceOfCalculus and ('is about' exactly 1 rdfbones:EntireTooth_fma55704)))	('has part' some (phaleron-dpatho:PresenceOfCalculus and ('is about' exactly 1 rdfbones:EntireTooth_fma55692)))	('has part' some (phaleron-dpatho:PresenceOfCalculus and ('is about' exactly 1 rdfbones:EntireTooth_fma55693)))	('has part' some (phaleron-dpatho:PresenceOfCalculus and ('is about' exactly 1 rdfbones:EntireTooth_fma55687)))	('has part' some (phaleron-dpatho:PresenceOfCalculus and ('is about' exactly 1 rdfbones:EntireTooth_fma57141)))	('has part' some (phaleron-dpatho:PresenceOfCalculus and ('is about' exactly 1 rdfbones:EntireTooth_fma57143)))	('has part' some (phaleron-dpatho:PresenceOfCalculus and ('is about' exactly 1 rdfbones:EntireTooth_fma57142)))	('has part' some (phaleron-dpatho:PresenceOfCalculus and ('is about' exactly 1 rdfbones:EntireTooth_fma57140)))	('has part' some (phaleron-dpatho:PresenceOfCalculus and ('is about' exactly 1 rdfbones:EntireTooth_fma55686)))	('has part' some (phaleron-dpatho:PresenceOfCalculus and ('is about' exactly 1 rdfbones:EntireTooth_fma55694)))	('has part' some (phaleron-dpatho:PresenceOfCalculus and ('is about' exactly 1 rdfbones:EntireTooth_fma55695)))	('has part' some (phaleron-dpatho:PresenceOfCalculus and ('is about' exactly 1 rdfbones:EntireTooth_fma55705)))	('has part' some (phaleron-dpatho:PresenceOfCalculus and ('is about' exactly 1 rdfbones:EntireTooth_fma55706)))	('has part' some (phaleron-dpatho:PresenceOfCalculus and ('is about' exactly 1 rdfbones:EntireTooth_fma55707)))	('has part' some (phaleron-dpatho:LocationOfCalculus and ('is about' exactly 1 rdfbones:EntireTooth_fma55702)))	('has part' some (phaleron-dpatho:LocationOfCalculus and ('is about' exactly 1 rdfbones:EntireTooth_fma55703)))	('has part' some (phaleron-dpatho:LocationOfCalculus and ('is about' exactly 1 rdfbones:EntireTooth_fma55704)))	('has part' some (phaleron-dpatho:LocationOfCalculus and ('is about' exactly 1 rdfbones:EntireTooth_fma55692)))	('has part' some (phaleron-dpatho:LocationOfCalculus and ('is about' exactly 1 rdfbones:EntireTooth_fma55693)))	('has part' some (phaleron-dpatho:LocationOfCalculus and ('is about' exactly 1 rdfbones:EntireTooth_fma55687)))	('has part' some (phaleron-dpatho:LocationOfCalculus and ('is about' exactly 1 rdfbones:EntireTooth_fma57141)))	('has part' some (phaleron-dpatho:LocationOfCalculus and ('is about' exactly 1 rdfbones:EntireTooth_fma57143)))	('has part' some (phaleron-dpatho:LocationOfCalculus and ('is about' exactly 1 rdfbones:EntireTooth_fma57142)))	('has part' some (phaleron-dpatho:LocationOfCalculus and ('is about' exactly 1 rdfbones:EntireTooth_fma57140)))	('has part' some (phaleron-dpatho:LocationOfCalculus and ('is about' exactly 1 rdfbones:EntireTooth_fma55686)))	('has part' some (phaleron-dpatho:LocationOfCalculus and ('is about' exactly 1 rdfbones:EntireTooth_fma55694)))	('has part' some (phaleron-dpatho:LocationOfCalculus and ('is about' exactly 1 rdfbones:EntireTooth_fma55695)))	('has part' some (phaleron-dpatho:LocationOfCalculus and ('is about' exactly 1 rdfbones:EntireTooth_fma55705)))	('has part' some (phaleron-dpatho:LocationOfCalculus and ('is about' exactly 1 rdfbones:EntireTooth_fma55706)))	('has part' some (phaleron-dpatho:LocationOfCalculus and ('is about' exactly 1 rdfbones:EntireTooth_fma55707)))	('has part' some (phaleron-dpatho:Hypoplasia and ('is about' exactly 1 rdfbones:EntireTooth_fma55702)))	('has part' some (phaleron-dpatho:Hypoplasia and ('is about' exactly 1 rdfbones:EntireTooth_fma55703)))	('has part' some (phaleron-dpatho:Hypoplasia and ('is about' exactly 1 rdfbones:EntireTooth_fma55704)))	('has part' some (phaleron-dpatho:Hypoplasia and ('is about' exactly 1 rdfbones:EntireTooth_fma55692)))	('has part' some (phaleron-dpatho:Hypoplasia and ('is about' exactly 1 rdfbones:EntireTooth_fma55693)))	('has part' some (phaleron-dpatho:Hypoplasia and ('is about' exactly 1 rdfbones:EntireTooth_fma55687)))	('has part' some (phaleron-dpatho:Hypoplasia and ('is about' exactly 1 rdfbones:EntireTooth_fma57141)))	('has part' some (phaleron-dpatho:Hypoplasia and ('is about' exactly 1 rdfbones:EntireTooth_fma57143)))	('has part' some (phaleron-dpatho:Hypoplasia and ('is about' exactly 1 rdfbones:EntireTooth_fma57142)))	('has part' some (phaleron-dpatho:Hypoplasia and ('is about' exactly 1 rdfbones:EntireTooth_fma57140)))	('has part' some (phaleron-dpatho:Hypoplasia and ('is about' exactly 1 rdfbones:EntireTooth_fma55686)))	('has part' some (phaleron-dpatho:Hypoplasia and ('is about' exactly 1 rdfbones:EntireTooth_fma55694)))	('has part' some (phaleron-dpatho:Hypoplasia and ('is about' exactly 1 rdfbones:EntireTooth_fma55695)))	('has part' some (phaleron-dpatho:Hypoplasia and ('is about' exactly 1 rdfbones:EntireTooth_fma55705)))	('has part' some (phaleron-dpatho:Hypoplasia and ('is about' exactly 1 rdfbones:EntireTooth_fma55706)))	('has part' some (phaleron-dpatho:Hypoplasia and ('is about' exactly 1 rdfbones:EntireTooth_fma55707)))	('has part' some (phaleron-dpatho:Abscess and ('is about' exactly 1 rdfbones:EntireToothSocket_fma317412)))	('has part' some (phaleron-dpatho:Abscess and ('is about' exactly 1 rdfbones:EntireToothSocket_fma317410)))	('has part' some (phaleron-dpatho:Abscess and ('is about' exactly 1 rdfbones:EntireToothSocket_fma317408)))	('has part' some (phaleron-dpatho:Abscess and ('is about' exactly 1 rdfbones:EntireToothSocket_fma317406)))	('has part' some (phaleron-dpatho:Abscess and ('is about' exactly 1 rdfbones:EntireToothSocket_fma317404)))	('has part' some (phaleron-dpatho:Abscess and ('is about' exactly 1 rdfbones:EntireToothSocket_fma317402)))	('has part' some (phaleron-dpatho:Abscess and ('is about' exactly 1 rdfbones:EntireToothSocket_fma317400)))	('has part' some (phaleron-dpatho:Abscess and ('is about' exactly 1 rdfbones:EntireToothSocket_fma317398)))	('has part' some (phaleron-dpatho:Abscess and ('is about' exactly 1 rdfbones:EntireToothSocket_fma317382)))	('has part' some (phaleron-dpatho:Abscess and ('is about' exactly 1 rdfbones:EntireToothSocket_fma317384)))	('has part' some (phaleron-dpatho:Abscess and ('is about' exactly 1 rdfbones:EntireToothSocket_fma317386)))	('has part' some (phaleron-dpatho:Abscess and ('is about' exactly 1 rdfbones:EntireToothSocket_fma317388)))	('has part' some (phaleron-dpatho:Abscess and ('is about' exactly 1 rdfbones:EntireToothSocket_fma317390)))	('has part' some (phaleron-dpatho:Abscess and ('is about' exactly 1 rdfbones:EntireToothSocket_fma317392)))	('has part' some (phaleron-dpatho:Abscess and ('is about' exactly 1 rdfbones:EntireToothSocket_fma317394)))	('has part' some (phaleron-dpatho:Abscess and ('is about' exactly 1 rdfbones:EntireToothSocket_fma317396)))	('has part' some (phaleron-dpatho:AlveolarResorption and ('is about' exactly 1 rdfbones:EntireToothSocket_fma317412)))	('has part' some (phaleron-dpatho:AlveolarResorption and ('is about' exactly 1 rdfbones:EntireToothSocket_fma317410)))	('has part' some (phaleron-dpatho:AlveolarResorption and ('is about' exactly 1 rdfbones:EntireToothSocket_fma317408)))	('has part' some (phaleron-dpatho:AlveolarResorption and ('is about' exactly 1 rdfbones:EntireToothSocket_fma317406)))	('has part' some (phaleron-dpatho:AlveolarResorption and ('is about' exactly 1 rdfbones:EntireToothSocket_fma317404)))	('has part' some (phaleron-dpatho:AlveolarResorption and ('is about' exactly 1 rdfbones:EntireToothSocket_fma317402)))	('has part' some (phaleron-dpatho:AlveolarResorption and ('is about' exactly 1 rdfbones:EntireToothSocket_fma317400)))	('has part' some (phaleron-dpatho:AlveolarResorption and ('is about' exactly 1 rdfbones:EntireToothSocket_fma317398)))	('has part' some (phaleron-dpatho:AlveolarResorption and ('is about' exactly 1 rdfbones:EntireToothSocket_fma317382)))	('has part' some (phaleron-dpatho:AlveolarResorption and ('is about' exactly 1 rdfbones:EntireToothSocket_fma317384)))	('has part' some (phaleron-dpatho:AlveolarResorption and ('is about' exactly 1 rdfbones:EntireToothSocket_fma317386)))	('has part' some (phaleron-dpatho:AlveolarResorption and ('is about' exactly 1 rdfbones:EntireToothSocket_fma317388)))	('has part' some (phaleron-dpatho:AlveolarResorption and ('is about' exactly 1 rdfbones:EntireToothSocket_fma317390)))	('has part' some (phaleron-dpatho:AlveolarResorption and ('is about' exactly 1 rdfbones:EntireToothSocket_fma317392)))	('has part' some (phaleron-dpatho:AlveolarResorption and ('is about' exactly 1 rdfbones:EntireToothSocket_fma317394)))	('has part' some (phaleron-dpatho:AlveolarResorption and ('is about' exactly 1 rdfbones:EntireToothSocket_fma317396)))
